{
  "$schema": "https://json-schema.org/draft/2020-12/schema",
  "$id": "https://github.com/schneiderjoseph/devia/schema/project-config.schema.json",
  "title": "DeviaProjectConfig",
  "description": "Shape of .devia/devia.json, written by `devia init` and read by validate, check, doctor and sync.",
  "type": "object",
  "required": ["standardVersion", "project", "maturity"],
  "properties": {
    "deviaVersion": {
      "type": "string",
      "description": "Version of the devia package that last wrote this file."
    },
    "standardVersion": {
      "type": "string",
      "description": "Version of the standard pinned in .devia/standard/. `devia sync` updates it."
    },
    "project": {
      "type": "object",
      "required": ["name"],
      "properties": {
        "name": { "type": "string", "minLength": 1 },
        "profile": {
          "enum": ["web-app", "service", "library", "cli", "design-system", "docs"]
        }
      }
    },
    "maturity": {
      "type": "object",
      "description": "Declared tier. Agents must never claim a tier the checks do not support.",
      "properties": {
        "target": { "enum": ["bronze", "silver", "gold", "platinum"] },
        "current": { "enum": ["bronze", "silver", "gold", "platinum"] }
      }
    },
    "code": {
      "type": "object",
      "description": "Paths that hold the code the memory describes; `devia doctor` compares their history with .devia/.",
      "properties": {
        "paths": { "type": "array", "items": { "type": "string" } }
      }
    },
    "modules": {
      "type": "object",
      "description": "Which parts of the standard apply to this project.",
      "properties": {
        "engineering": { "type": "boolean" },
        "design": { "type": "boolean" },
        "memory": { "type": "boolean" }
      }
    },
    "context": {
      "type": "object",
      "description": "Target and mode for `devia context`. Absent means the built-in defaults; the selector degrades to them rather than failing.",
      "properties": {
        "budget": {
          "type": "integer",
          "minimum": 1,
          "description": "Estimated tokens one task's context should cost. A target, not a floor: the mandatory items are admitted before it is consulted, and `mode` decides what happens when they cost more."
        },
        "maxTokens": {
          "type": "integer",
          "minimum": 1,
          "description": "The first shipped spelling of `budget`. Still read when `budget` is absent, so an early adopter keeps working untouched."
        },
        "mode": {
          "enum": ["advisory", "strict"],
          "default": "advisory",
          "description": "advisory: mandatory items are always delivered whole and the target is reported as exceeded. strict: the target is never exceeded — mandatory items are compressed toward their identifier, never dropped, and a target too small for even that is reported as impossible rather than silently exceeded."
        }
      }
    },
    "contribution": {
      "type": "object",
      "description": "`devia contribute`. Everything local works without this; nothing leaves the machine without it.",
      "properties": {
        "enabled": {
          "type": "boolean",
          "description": "false turns the whole feature off, locally included."
        },
        "identity": {
          "type": "string",
          "description": "The GitHub account a contribution is published under. Never the maintainer's, never inferred from the user's git config."
        },
        "remote": {
          "type": "string",
          "description": "owner/repo to file against. Defaults to the devia repository."
        }
      }
    },
    "waivers": {
      "type": "array",
      "description": "Time-boxed exceptions. An expired or undated waiver fails `devia check`.",
      "items": {
        "type": "object",
        "required": ["rule_id", "reason", "owner", "expires"],
        "properties": {
          "rule_id": { "type": "string", "pattern": "^[A-Z][A-Z0-9]*(-[A-Z0-9]+)+$" },
          "scope": { "type": "string" },
          "reason": { "type": "string", "minLength": 10 },
          "owner": { "type": "string" },
          "expires": { "type": "string", "format": "date" },
          "risk": { "enum": ["low", "medium", "high"] }
        }
      }
    },
    "initializedAt": { "type": "string", "format": "date" }
  },
  "additionalProperties": true
}
