{
  "deviaVersion": "0.8.0",
  "standardVersion": "0.2.0",
  "project": {
    "name": "devia",
    "profile": "cli"
  },
  "maturity": {
    "target": "gold",
    "current": "bronze"
  },
  "code": {
    "paths": [
      "src"
    ]
  },
  "modules": {
    "engineering": true,
    "design": false,
    "memory": true
  },
  "context": {
    "budget": 2400,
    "mode": "advisory"
  },
  "contribution": {
    "enabled": true
  },
  "waivers": [],
  "initializedAt": "2026-09-03"
}
